year,search term,sentence,score
2018,interview,"Meatboi96 wrote:  My application is still processing. Have not been rejected yet and besides I think I score better than you for O level You do not need to boast here that your O Level has scored very well. We are all very aware that you are a 6-pointer as you claimed.Meatboi96 wrote:  Please keep the discussion related to university. This thread not about ns. Above all, be good to your parents, may you be well and happy  Amen  You do not need to tell everyone that this is a university thread, everyone knows. tt32003 started the post about NS as NSFs take time off to settle their individual university admission matters, as long as they are on topic, no reason to fault them. You on the other hand, appears to me that you rode along the NS discussion topic:Meatboi96 wrote:  What is EIS? Do you think being an officer helps in the CCA records? I think it increases my chances right? I heard NUS takes into account O level results as well and I think with my L1R4 6 points it will help out? Meatboi96 wrote: I got into command school through my sheer hard work and determination and I believe I can do it again when applying for medicine course. Meatboi96 wrote:  Even though what you just said is realistic but I believe that with my sheer hard work and dedication I will be able to make it into medicine just like how i persevere through my O level and BMT to get 6points L1R4 and Officer. I always manage to prove nay sayers wrong. I don’t know why you have to be a wet blanket and try to put me down. From my POV, he is not being a wet blanket. Everyone here is trying to tell you that your chances are low, I do not know why you keep harping on your O Level score and being a high flyer soldierMeatboi96 wrote:  You still haven’t explain to me why you are being a wet blanket. And besides I have got a pretty high GPA among all my friends. I am the second in my clique, the first got 2.7 GPA. The teacher mention to me once after class that I am a bright student with the potential to achieve my dreams as shown from what I have achieve during O level which i got 6points (L1R4). And it appears to me that you are challenging the people around here. I do not think you are the only 6-pointer in Singapore.Meatboi96 wrote:  I believe my O level result of 6points is higher than what you had achieved. Therefore me having 2.537 might stand a better chance than you who scored a 3.5X. Meatboi96 wrote:  @geeniee Correction L1R4 6points and my L1R5 is 8points (which is probably higher than you) Btw are you a MEDICAL student? how you know I will fail if I haven’t try it yet. I have been preparing for the medical interview intensively and I believe my answers are really solid. Forgot to mention that I actually work as a sales assistant in Watson and made two pharmacist friends there. The members here in general are not telling you to stop trying, neither did they tell you to stop dreaming, they are just telling you the probability of getting to the dream institution that you desire. The cards are on the table, it is up to you whether you want to look at them or not. You got the determination, good for you, we like it, but there is a difference between that and being a nuisance. If your intention here is to troll, then I am sorry to say, this is not the right place.  If you continue to be arrogant here, I do not care whether you are the PM's son or a high-flying rank airborne commando officer with 6-pointer in your O Levels, your account will be restricted for forum nuisance. Perhaps you can come back and let us know if you have attained your goal to prove us folks wrong. Good luck and peace out. O",12.358598162561314
2018,interview,"So, ntu & smu got give extra 1.25 points extra for putting first choice ? Thanks whuttt wrote:  Good news for those borderline cases eyeing NUS "" . . . . the plan to award up to 1.25 bonus points (equivalent of one H1 grade) to students applying for their first choice programme. The bonus points, applicable to programmes not requiring a pre-entry interview, will be added to the student’s University Admission Score. "" http://news.nus.edu.sg/highlights/nu...on-initiatives NUS applicants to get bonus points for 1st-choice courses Passion for a field of study will count for admission to the National University of Singapore (NUS) from this year. Those applying for a place at NUS will be given 1.25 bonus points for their first choice - equivalent to going from C to B or B to A in an A-level H1 subject. This applies only to courses where entry is based purely on converting a student's grades into points, and not to courses such as medicine and law where students are assessed on their aptitude and interests through interviews. NUS senior deputy president and provost Ho Teck Hua, who announced the move at a press conference on Monday, said NUS analysis of admission data showed the bonus point can make a difference. ""Let's say one student with 81 points applies for communications as his first choice, and another with 82 points applies to the same course as his second choice. With the 1.25 points, the student who lists the course as his first choice will get ahead of the person with 82 points,"" he said. On why NUS decided on the move, he said: ""If you have done well and are passionate about a career in business or computing, for example, then we want to say to you that we support your passion."" ""We want to help you pursue your passion,"" he said, adding that students passionate about what they study tend to perform better. Professor Ho revealed that, currently, 65 per cent of students given a place in their first-choice course take up the offer, while only 45 per cent of those given their second-choice course do so. Noting NUS graduates' good job prospects, Prof Ho also announced that NUS will be increasing the number of double majors to increase career options for its graduates. ""The nature of work is changing very rapidly, and we need to prepare students for a lifetime of diverse careers,"" he said. He said NUS, which currently offers 94 double major and major-minor combinations, will add another 86 such programmes. ""Someone doing data science and entrepreneurship, for example, can go and work for a range of industries in data science, and also go and do a start-up."" On top of the double majors, NUS also offers 71 double degrees, 33 joint degrees with partner universities and 24 concurrent degrees. Adding all this, currently 15 per cent of NUS students are trained in more than one discipline. Prof Ho said he hopes half of all NUS students will graduate with knowledge and skills in two different fields, so they will have more job offers to choose from. He also announced two new degree programmes for this year, one in pharmaceutical science and the other in veterinary science. Students taking up the 5 1/2-year concurrent veterinary degree programme will graduate with an NUS degree in life sciences and a Doctor of Veterinary Medicine from the University of Melbourne. NUS, which now offers 230 bond-free merit scholarships, will add 200 more scholarships for the new academic year. Ms Geraldine Tan, 19, welcomed the move by NUS and said it is important for young people to get into a field that excites them. She said: ""I really want to study business and maybe go on an overseas college stint as I want to start a social enterprise. Business courses are hard to get into, so I am hoping the bonus points will help me get the edge."" Hwa Chong Institution student Hannah Ganesh, 18, said increasing double degree options is good as students can diversify their learning and ""challenge themselves"".http://www.straitstimes.com/singapor...choice-courses NUS' new offerings BONUS POINTS FOR FIRST CHOICE Students applying to NUS will be given 1.25 bonus points for their first-choice course. This applies only to courses where entry is based purely on students' grades. MORE DOUBLE MAJORS NUS will be increasing the number of double majors to open up more career options for its graduates. It currently offers 94 double major and major-minor combinations and will add another 86 such programmes. NEW DEGREES A new concurrent degree combines NUS' Bachelor of Science and the Doctor of Veterinary Medicine offered by the University of Melbourne. Students can complete the programmes in 5-1/2 years. NUS is also offering a new joint degree in pharmaceutical science with the University of Dundee in Scotland. The programme is designed to provide students with knowledge and skills for careers in the pharmaceutical, biomedical and consumer healthcare sectors. NUS OVERSEAS COLLEGES The programme that sends students on internships to several entrepreneurial hubs in the world will be extended to Jakarta and Toronto. MORE BOND-FREE SCHOLARSHIPS NUS, which now offers 230 bond-free merit scholarships, will add another 200 scholarships in the new academic year. ",12.270981336814053
2018,interview,"Good news for those borderline cases eyeing NUS "" . . . . the plan to award up to 1.25 bonus points (equivalent of one H1 grade) to students applying for their first choice programme. The bonus points, applicable to programmes not requiring a pre-entry interview, will be added to the student’s University Admission Score. "" http://news.nus.edu.sg/highlights/nu...on-initiatives NUS applicants to get bonus points for 1st-choice courses Passion for a field of study will count for admission to the National University of Singapore (NUS) from this year. Those applying for a place at NUS will be given 1.25 bonus points for their first choice - equivalent to going from C to B or B to A in an A-level H1 subject. This applies only to courses where entry is based purely on converting a student's grades into points, and not to courses such as medicine and law where students are assessed on their aptitude and interests through interviews. NUS senior deputy president and provost Ho Teck Hua, who announced the move at a press conference on Monday, said NUS analysis of admission data showed the bonus point can make a difference. ""Let's say one student with 81 points applies for communications as his first choice, and another with 82 points applies to the same course as his second choice. With the 1.25 points, the student who lists the course as his first choice will get ahead of the person with 82 points,"" he said. On why NUS decided on the move, he said: ""If you have done well and are passionate about a career in business or computing, for example, then we want to say to you that we support your passion."" ""We want to help you pursue your passion,"" he said, adding that students passionate about what they study tend to perform better. Professor Ho revealed that, currently, 65 per cent of students given a place in their first-choice course take up the offer, while only 45 per cent of those given their second-choice course do so. Noting NUS graduates' good job prospects, Prof Ho also announced that NUS will be increasing the number of double majors to increase career options for its graduates. ""The nature of work is changing very rapidly, and we need to prepare students for a lifetime of diverse careers,"" he said. He said NUS, which currently offers 94 double major and major-minor combinations, will add another 86 such programmes. ""Someone doing data science and entrepreneurship, for example, can go and work for a range of industries in data science, and also go and do a start-up."" On top of the double majors, NUS also offers 71 double degrees, 33 joint degrees with partner universities and 24 concurrent degrees. Adding all this, currently 15 per cent of NUS students are trained in more than one discipline. Prof Ho said he hopes half of all NUS students will graduate with knowledge and skills in two different fields, so they will have more job offers to choose from. He also announced two new degree programmes for this year, one in pharmaceutical science and the other in veterinary science. Students taking up the 5 1/2-year concurrent veterinary degree programme will graduate with an NUS degree in life sciences and a Doctor of Veterinary Medicine from the University of Melbourne. NUS, which now offers 230 bond-free merit scholarships, will add 200 more scholarships for the new academic year. Ms Geraldine Tan, 19, welcomed the move by NUS and said it is important for young people to get into a field that excites them. She said: ""I really want to study business and maybe go on an overseas college stint as I want to start a social enterprise. Business courses are hard to get into, so I am hoping the bonus points will help me get the edge."" Hwa Chong Institution student Hannah Ganesh, 18, said increasing double degree options is good as students can diversify their learning and ""challenge themselves"".http://www.straitstimes.com/singapor...choice-courses NUS' new offerings BONUS POINTS FOR FIRST CHOICE Students applying to NUS will be given 1.25 bonus points for their first-choice course. This applies only to courses where entry is based purely on students' grades. MORE DOUBLE MAJORS NUS will be increasing the number of double majors to open up more career options for its graduates. It currently offers 94 double major and major-minor combinations and will add another 86 such programmes. NEW DEGREES A new concurrent degree combines NUS' Bachelor of Science and the Doctor of Veterinary Medicine offered by the University of Melbourne. Students can complete the programmes in 5-1/2 years. NUS is also offering a new joint degree in pharmaceutical science with the University of Dundee in Scotland. The programme is designed to provide students with knowledge and skills for careers in the pharmaceutical, biomedical and consumer healthcare sectors. NUS OVERSEAS COLLEGES The programme that sends students on internships to several entrepreneurial hubs in the world will be extended to Jakarta and Toronto. MORE BOND-FREE SCHOLARSHIPS NUS, which now offers 230 bond-free merit scholarships, will add another 200 scholarships in the new academic year.",12.193614633398331
2018,interview,"Hi ! ~  I just wanna say good job to those who completed the interview for SIT allied health whether or not you have succeeded in being accepted.  For those whom will be attending the upcoming Tea Session, you will actually find out that how lucky u r to get it cos the numbers arent exactly very large (particularly RT cos the intake is only about 18 students).  Those who got shortlisted for interview is already considered very good. Because majority of the students would have gotten rejected from the start. And from the interview itself only about 1-2/8 students will get accepted.  So dont feel too upset about it as well.  To those who plans to try again, GO FOR IT! But do prepare your portfolio in the 1 year apart. Because once u have been shortlisted for interview, results and all no longer matters. It is merely about who u r ... interviewers have 0 knowledge or background on u , it is just how u r reacting. It is normal to fail one or two stations, but more importantly is not letting it affect you.  After all , if u want to be an Allied Health professional u have to strong mentally.  The interview gives u a glimpse of school life. In SIT we go by Trimesters, so this mean to say it is definitely more stressful. U will need to write at least an essay per trimester , so be prepared.  Even for those who got accepted, the tip is just PLAY WHILE U CAN NOW.  Just to share a personal story for those who didnt got in :  2017 was the first year this course started , to be honest i found out the minimum GPA for that year from friends who got in ... it was at least 3.7 just for interview.  I attempted as well (i wanted medicine), but i didnt even got shortlisted.  Yes, it is sad to be rejected ( in fact i applied to NTU, NUS and SIT i got rejected for all of them). But what is more important is , what u plan to do.  Getting sad is inevitable , but it doesnt get u anywhere. Why not let it be ur motivation ? Go for shadowing programmes- see if u r really in for it (we have ppl who realised it isnt their thing after getting in). Volunteer - Gain some experience and show them healthcare is for you.  Lastly, for me ... it was hard but as a poly grad i had issues finding jobs even. Eventually, i lowered myself and worked as a hospital patient assistant for a year. No doubt, it was difficult but at the end of it i do learn something.  I made use of my time in the healthcare setting understanding more on it, being look down is common but it makes u a better healthcare professional when u have experience what it is like to be the one being looked down before u become the one ordering people ard.  Eventually i got in and it was a miracle.  So it is not impossible to get in again but of course success is yours only if u have worked hard for it.  So, dont give up if it is really what u want.  And congratulations to those who got in .... ",12.11383068927782
2018,interview,"Poty321 wrote:  Hello there! Totally agree with you that scholarship should not be awarded based on academic performance only, which I did mention in my earlier post. The primary objective of my earlier post aims to encourage individuals who are currently applying/appealing for admission and/or scholarship - through the sharing of my education journey and the challenges experienced as an individual with a disadvantaged background. Subsequently, the post also seeks to highlight the flaws in the basis of selection for the scholarship interview. Today, institutions are still using a uniform assessment method to evaluate people of diverse backgrounds. The assessment for academic potential is pretty straightforward - cGPA, awards, and other academic achievement obtained from other sources (e.g. competitions, courses, etc.). The tricky part lies in the assessment of non-academic components - institutions seek individuals with certain attributes, qualities, and skills (e.g. leadership, teamwork, entrepreneurship, integrity, sports achievement, etc.). And often, institutions only consider school-related activities and/or co-curricular activities as the samples for their assessment.  On a personal note, I believed that those attributes, qualities, and skillscould also beidentified and assessed through employment experience (e.g. customers' testimonials, appraisals by superiors, awards attained, etc.).  In general, institutions should also look beyond the school-related activities and co-curricular activities when assessing the non-academic components of individuals. Hence, granting more flexibility for underprivileged students whose non-academic profile were considered as ""insubstantial"" and thereby allowing  them to have the opportunity to share their stories. Ultimately, an interview is all we need.P.s. I'm glad that your hard work paid off, and congrats on securing that scholarship offered by a private company  (I missed the application deadline for private & government scholarship ) To be shortlisted for interview on the government scholarship with 3.5GPA, you must have some really outstanding non-academic achievements! Do you mind to share with us? And hello senior , assuming you are an SMU student (based on the GPA capped at 4.0). As an individual with similar experience, juggling between full-time work and study is really no joke, not to mention that you are doing it at the University-level and still managed to scored a decent grade. Mind to share what full-time job you work as? Do you study in the day, and work at night/after-school hours? Did you, perhaps, packed all modules into that few days so that you could work for the rest of the days in the week? Sincerely hope that you can share some tips with us/me Networking/cloud computing consultant. And if you can get some really well-known individual in the industry to write recommendation letter would really be helpful.  I think due to my competition award as well as the system I build for one of the major hospital which became part of the national healthcare system.  But other than that the majority of the attendees maintain a minimum gpa of 3.9.",12.112806405626642
2019,interview,"Joshuagohwj wrote:  Wow bro, thank you for sharing! I am in the banking industry, very tired of punching meaningless numbers and decide i want to do something meaningful like physio . I did alot of volunteering work but they are not related to physiotherapy.  I got quite shitty A lvls grades 10 years ago, not sure if this is the main reason for rejection/not even shortlisted for interview. Not sure if i should retake my a lvls.. hopefully we will man. All the best So did you apply this year? Did you get an interview? I attended the PCP-preview-briefing and met a PCP-year 1 Physio Student that was, like you formerly from Finance Industry. She said her A Level results were pretty decent, which might be why she got into the course. I tried again this year. I did a metric crap-ton of volunteering with 2 different Hospitals *AND* I managed to get a job as a Physiotherapy Assistant using that Volunteer experience. The pay is horrible, the hours are worse and it's an hour+ bus ride from my house to work each way. Though it's a small price to pay for the invaluable clinical experience *PLUS* the increased profile as far as potentially getting into the course. In addition, whole learning experience in these past 6 months has been incredible, to say the least...loveaddict wrote:  Can I ask why physio? There are other prog available also you can look at. Physio not easy... Suggest you go do some job shadowing first. Well, I can only speak for myself: I already did that!  I know it ain't easy, having to lift at least 2 high-dependency patients a week (I know that might not sound like much but it's inherently risky for both me and the patient) and the facilitation required for some patients to move properly is a *HUGE* learning curve and have already strained a few joints here and there, more than my entire decade as a Personal Trainer, PE Teacher, even as a Combatives & Self Defense Instructor with full-contact sparring hasn't seen this many strains in the 6 months on the job. A colleague has been on at least a month of light duties as a result of back strain she encountered while trying to assist a super-maximum-dependency patient (she failed, the patient fell  ). But it's incredibly fulfilling.Skywalker7 wrote:  Yup, I was from nursing and paramedicine course as well and they provide equally fulfilling career opportunities as well(Definitely not a desk-bound job lol). There is also occupational therapy as well.  Heard physiotherapy is a pretty popular choice. What with all the hype about physio anyways? Me thinks it's a follow-on from the fact that the Poly course @ NYP is gone, which has been popular for the longest time. That and the fact that it may very well be seen as a ""glamorous"" potentially high-paying job (if you get into private practice, maybe, though I may be totally off on that), maybe add to the fact that it's also a way to get into a medical-type field without being a Doctor or Nurse... For me, I have an indelibly greater connection with the profession, on top of my work experience and education, as I am a living, breathing success-story, having suffered multiple injuries in a near-fatal car crash, successfully rehabilitated and fully recovered through intensive Physiotherapy. It's my way of also ""giving back"" as well. So that's how I see it. Can't speak for everyone else...",13.502111232970343
