year,search term,sentence,score
2016,interview,"mansae wrote:  Omg...haha was ur topic on diversity also? what ur prof say sia? They asked me whether it's justifiable to discriminate based on race and I said yes because sometimes the nature of the industry requires it. For example construction industry, u need to liaise with mostly contractors who can only speak Chinese and Hokkien so it is natural that a Chinese should be hired over a Malay or Indian. I scared they think I racist *cries*. All other candidates seem to give correct answers so IDK what possessed me to take such a gamble xannelle wrote:  YES that was a shyt topic that I couldn't relate to at all... I think my profs asked if age discrimination is prevalent anywhere. But my answer was something like ""we need people of all age to help in product creation, like how young people are capable of picking innovative things and the old people are capable of picking durable things"" (???) OMG now that I think of it I think I really ran out of topic ... And I even blurted ""I don't know what I'm talking about"" The prof was like ""I'm not trying to make fun of you but I think we are talking about discrimination (blahblahblah), but you're pointing out their usefulness"" T_T I think your answer is correct eh, heard that they are not so strict w the interviewees' answers. At least you answered their Q!!! The others in my group also gave very strong and reasonable points to the profs' Q, with news as backup somemore. Wa fk man I feel that I left a bad impression on them, like I'm damn dumb or something I climb out of my bed at 2 am to post this haha.  If I'm the one in the interview i would answer this it's justifiable to discriminate based on race Discrimination in work should't be based on race but rather the person's ability to accept that there's people better than him/her, the person's ability to adapt to the environment and situation. A company with a diverse culture and background will be able to adept to different client based on their background making them feel like home while working with the company. A great team leader or boss will understand that there's always people better than them and their ability to accept them and not be jealous or potentially fearing that they may one day be replacing them will help the company push towards greater height.  As such, there's really no reason to discriminate others based on their race, rather we should be looking at the individual's potential contribution and ability to adept. Because i'm not sure how to understand this, i try to swing the question away. Another way is to provide a agree and disagree argument. You can also try to use points mention by your group such as ""I agree with simon and sam that bla bla bla. To add on to their point...bla bla bla. This shows you are thinking and listening to what others are saying and not just thinking of what to say making you a team player as well As for the age 1.  Age discrimination has and will always be an issue. We used to discriminate the younger generation, thinking they lack the experience to work as productivity as the older generation and being overly sheltered. But as we advance rapidly in technology, shifting towards work automation having machines replacing humans. it makes more sense to hire younger people that's capable of instantly understand how a machine works without much explanation or guidance.  The society is cruel and I simply do not see a value in hiring the older PMET while the younger one are capable of doing much more at half the cost. While hypocrite may suggest that the elderly are gems and should be highly value, they are simply talk the talk and not walk the talk. And as such age discrimination is a fact and it's a problem deeply rooted into society. I just strongly lean towards one side based on what i think. The question no right and wrong 1 la. They just wanna see how you think and if you are gonna swing towards other's opinion or hold on to yours  This is just my POV ah... Let me know what you guys think. To end this, i ask you guys this question.. Don't think more than 10 sec..  ""Plan an evacuation route."" Hint. Would you ask me a question or would you plan it and what's your plan?",13.291794596498308
2016,interview,"Aomatsu wrote:  Background: Diploma in Accountancy Applied for: ACBS Just finished my interview with NTU NBS, and here are few examples of questions they asked;Generic Questions 1. Describe yourself. 2. Why do you think we should accept you? How can you contribute to NTU? 3. Did you apply in other Universities as well?Probing Questions 1. Describe yourself in 2 sentences. [Stress Test -1] 2. Describe yourself in only 3 words. [Stress Test -1] 3. Which community areas did you serve? [Probing CCAs & Interests -2] 4. Why didn't you apply for Humanities & Social Studies instead? [Probing CCAs & Interests -2] 5. Why do you still want to choose NTU instead of NUS? [Universities Choice -3] Below are just my opinions. The interview ended surprisingly faster than expected - far less than 10 minutes. However, there were no questions related to assess my competency for ACBS, and I guess that these questions are completely the same as single degree interview. Also, I doubt they even know what I actually applied for. So for those who are applying ACBS as well, do rest assure.  Comparing NTU and SMU, I find that NTU is more rigid in the way they conduct their interviews. They seem to have a list of standardized questions to be asked. Whereas for SMU, after I spoken about my attachment in one of the Big 4, the whole conversation was all about the work I did, and how I was able to cope with stress in the environment. Very friendly professors. As such, it is much easier to control your conversation topic for SMU. Again, in my opinion, NTU is more interested in how you can contribute to NTU. Whilst for SMU, the professors really want to know you as an individual. Also, the interviewers in NTU seem to be expressionless; it feels that I was talking to robots, but at the very least they did hold eye contact with me. Both are equally efficient in conducting their interviews nevertheless. Generally agree with Aomatsu.  Just to add on, I went for the ACBS interview back in 2014, because, you know, NS, and the main interviewer was Prof Valerie. We had a rather entertaining conversation and it was more of a chit-chat session than an interview. NTU knows what courses you applied for. She had my application form in hard copy on the table (in full view) and asked me why I applied for REP as my 2nd choice, and only put Accountancy (single degree) as the 3rd choice. Other than that, the main focus was definitely on how I would contribute NTU if they offered me a place/scholarship. Of course I talked about joining some clubs in NBS, my career goals and the various competitions/events at NTU which interest me. They didn't ask me those ""essay"" kind of questions though, but we chatted for around 20 minutes. It was a very light-hearted and enjoyable session and it felt really short in fact. After the interview, the prof invited me to apply for the USP. I also went for the SMU interview (also in 2014) for the double degree programme in Accountancy and Business. I remember being interviewed by Prof Seow and Prof Gary Pan. They seemed really concerned about whether I applied to NUS/NTU and asked me which I would pick if I was offered all 3. It somehow gave me the impression that they were being insecure/desperate. However, I liked the fact that they gave more attention to my hobbies and interests and focused less on academic achievements. I guess this is one example of SMU's holistic admissions process. They were also constantly marketing their school throughout the interview by asking me if I knew that their school of accountancy was ranked xxx in the BYU rankings etc, and kept comparing them to the other 2 unis. What I got out of that interview was that the profs at SMU are really passionate about what they do and that they're incredibly driven especially when it comes to building the school's reputation.  At the end of the day, both are local universities. Employers will lump NUS/NTU/SMU together anyway. So in terms of employability, no difference really. Choose the school which suits your personality better.",13.25915242897178
2016,interview,"SINGAPORE: Three of Singapore's autonomous universities are refining the way they admit students under the Discretionary Admissions Scheme, which looks beyond a person's academic achievements. It comes as the universities prepare to take in more students under the scheme, when the current cap of 10 per cent allowed for discretionary admissions goes up to 15 per cent next year. ADVERTISING inRead invented by Teads National University of Singapore (NUS) is offering 7,000 places for the coming academic year, but it has received four times the number of applicants. While it has started handing out offers to those who made the cut based on their grades, about 1,800 students who did not are undergoing interviews to be considered for discretionary admissions this year. NUS has been evaluating and admitting more students under the scheme over the years. Last year, it evaluated 1,600 students, 400 more than 2014. 670 of them got in, 70 more than 2014. With more students expected to be considered for discretionary admissions, the process at NUS may be refined. Said Professor Tan Eng Chye, deputy president of academic affairs at NUS: “We are evolving; for instance, we have gotten alumni to help us with the interviews. I find that very useful because the alumni have a lot of experience in sizing up people and candidates, and they ask very useful questions. “We also provide more data on what to look out for and if the numbers get to be big, we may decide that maybe we can have sort of a test first - not an academic test per se, but perhaps a test to look at other non-academic aspects of that person. It could be an aptitude test.” Prof Tan added: “Exercising flexibility is one aspect; you also have to be fairly sharp on what to look for - it is not simply: 'OK, meet the numbers.' Our interest is to look for attributes of the applicants that would make the student community more interesting, more diversified, and enhance the interaction within the student community. “Those who can adequately and can eloquently convey their passions and interests - that would be advantageous. But we also have to look out for students who may not be able to communicate as well, but yet they have the potential for us to groom them to be able graduates.” At the Singapore Management University (SMU), discretionary admissions currently form about 5 to 8 per cent of the annual intake. With the higher cap of 15 per cent for such admissions next year, the university will have ""more leeway"" when assessing students. Professor Pang Yang Hoong, vice provost for undergraduate matters and student development at SMU, said: “For SMU, looking at students with other qualifications is not something terribly new because we always been holistic in the way we assess students and their suitability for admission. We will be more flexible. “(We look for) passion, the aptitude for the course for which we are admitting them into. It would also be ideal if students have demonstrated that they are successful to be in time management, that they also possess resilience and the ability to overcome difficult situations. This will help us to assess if that person has got the resilience and the determination to do well in the programme.” SMU is expecting more polytechnic graduates to apply through the discretionary route with the cap being raised to 15 per cent of the annual intake. Nanyang Technological University (NTU) will also ""broaden the criteria"", to give more people a shot at securing a place. It will favourably consider those who possess ""enthusiasm and relevant work experience"". Professor Kam Chan Hin, senior associate provost for undergraduate education at NTU, commented: “Normally, they will look at other achievements that they have - whether in sports, in arts … or even if they are very passionate about community service, leadership. So these are the things that we usually look for. “We are going to encourage all the schools to broaden the criteria, to allow more people who have a very strong passion, to be given the opportunity to be interviewed. We should be more adventurous, open it a bit more and ask more questions, outside of the usual parameters, and if you find somebody who is really very interesting and very passionate … give them a chance.” NTU had evaluated 1,400 students under the scheme last year and about 600 were given a place. All three universities said that even as they exercise flexibility, it is still important for students to show that they possess the ""adequate academic competence"" to go through the rigour and demands of a university education.  - CNA/ms",13.16363725774696
2016,interview,"photobuff wrote: New SMU course: 1,108 vying for 45 placesCombination of politics, law and economics proves a winner; total number of applications up 6% to 14,000 Sandra Davie, Senior Education Correspondenthttp://www.straitstimes.com/singapor...-for-45-places A new degree course at Singapore Management University (SMU) which offers a combination of politics, law and economics (PLE) is a hit with young Singaporeans hoping to land a university place this year. SMU received 1,108 applications for the 45 places in the course, which means about 25 students are vying for every place. The demand for the new course has also led to a rise in total number of applications - 14,000 in all this year, a 6 per cent rise over last year. Earlier this year, when SMU announced the new course, its officials likened it to Oxford University's prestigious politics, philosophy and economics course. It is aimed at giving students a broad understanding of how the world works and will prepare them for a range of careers. Students who had applied for the course said it is an unusual combination since it includes the study of law with economics and politics - and prestigious to boot as it is being offered to only a select group of high-calibre students. Many were also drawn by the fact that the course would prepare them for a wide range of jobs, including in journalism, foreign affairs, public service, consulting and research. SMU provost Lily Kong said she was delighted with the response. She added: ""From all our engagement sessions, it is clear that students, parents and employers recognise the value that the PLE combination of disciplines can bring in preparing graduates who can handle multifaceted careers... ""Through a deeper understanding of how politics, law and economics intersect to shape the world in which we live, we hope to groom a new generation of leaders and thinkers for Singapore."" The 45 students selected for the course will take all three subjects in the first year, before specialising in one of four areas - global studies, distribution and justice, public policy and governance, or choice and behaviour - from year two. Students will also have to go on a 10-week internship during which they will work on a project to find solutions to a real-world problem. SMU said several firms have indicated their interest in offering internships to those on the course. They include the Economic Development Board as well as consultancies like Bain and Company. SMU officials said close to 5,000 of the 14,000 applicants have been shortlisted so far. They will be further assessed via interviews. Professor Kong said that, besides academic results, SMU uses other criteria for admission. ""Exam grades are a valid measure, but they cannot be the sole measure of a student's ability."" The university is the first in Singapore to require all [shortlisted] candidates to attend an interview. It started the practice 16 years ago, when 2,000 students applied to become part of its pioneer batch. Interviews are still required now, although the number of candidates shortlisted for the six undergraduate degree courses has trebled. They are conducted individually or in groups, with professors on the lookout for intellectual curiosity and leadership qualities. SMU said a select group of students - about 1,000 - with strong academic and other abilities were invited to visit the university on ""SMU Discovery Day"" this year. Prof Kong said: ""Our engagement is directed at confirming that they are indeed an excellent match for the education that SMU offers, and for them to confirm that SMU is the university of choice for them."" A-level holder Benedict Lim, 20, who applied for the PLE course, said: ""I have an interest in both (law and economics) and had a hard time picking one, so when I heard about SMU's new course, I jumped at the chance."" He is keen on a broad-based education as he believes it will train him to be versatile and adaptable and enable him to switch careers. ""You know what they say about students having to take on jobs that don't exist today. ""I really do believe that. That's why it is best to have a broad-based education, so that you have a broad understanding of issues and how the world works."" Probably an inflated nunber What they shld publish rather is the number of ppl putting that as their first choice at smu",13.09252154640386
2016,interview,"New SMU course: 1,108 vying for 45 placesCombination of politics, law and economics proves a winner; total number of applications up 6% to 14,000 Sandra Davie, Senior Education Correspondenthttp://www.straitstimes.com/singapor...-for-45-places A new degree course at Singapore Management University (SMU) which offers a combination of politics, law and economics (PLE) is a hit with young Singaporeans hoping to land a university place this year. SMU received 1,108 applications for the 45 places in the course, which means about 25 students are vying for every place. The demand for the new course has also led to a rise in total number of applications - 14,000 in all this year, a 6 per cent rise over last year. Earlier this year, when SMU announced the new course, its officials likened it to Oxford University's prestigious politics, philosophy and economics course. It is aimed at giving students a broad understanding of how the world works and will prepare them for a range of careers. Students who had applied for the course said it is an unusual combination since it includes the study of law with economics and politics - and prestigious to boot as it is being offered to only a select group of high-calibre students. Many were also drawn by the fact that the course would prepare them for a wide range of jobs, including in journalism, foreign affairs, public service, consulting and research. SMU provost Lily Kong said she was delighted with the response. She added: ""From all our engagement sessions, it is clear that students, parents and employers recognise the value that the PLE combination of disciplines can bring in preparing graduates who can handle multifaceted careers... ""Through a deeper understanding of how politics, law and economics intersect to shape the world in which we live, we hope to groom a new generation of leaders and thinkers for Singapore."" The 45 students selected for the course will take all three subjects in the first year, before specialising in one of four areas - global studies, distribution and justice, public policy and governance, or choice and behaviour - from year two. Students will also have to go on a 10-week internship during which they will work on a project to find solutions to a real-world problem. SMU said several firms have indicated their interest in offering internships to those on the course. They include the Economic Development Board as well as consultancies like Bain and Company. SMU officials said close to 5,000 of the 14,000 applicants have been shortlisted so far. They will be further assessed via interviews. Professor Kong said that, besides academic results, SMU uses other criteria for admission. ""Exam grades are a valid measure, but they cannot be the sole measure of a student's ability."" The university is the first in Singapore to require all [shortlisted] candidates to attend an interview. It started the practice 16 years ago, when 2,000 students applied to become part of its pioneer batch. Interviews are still required now, although the number of candidates shortlisted for the six undergraduate degree courses has trebled. They are conducted individually or in groups, with professors on the lookout for intellectual curiosity and leadership qualities. SMU said a select group of students - about 1,000 - with strong academic and other abilities were invited to visit the university on ""SMU Discovery Day"" this year. Prof Kong said: ""Our engagement is directed at confirming that they are indeed an excellent match for the education that SMU offers, and for them to confirm that SMU is the university of choice for them."" A-level holder Benedict Lim, 20, who applied for the PLE course, said: ""I have an interest in both (law and economics) and had a hard time picking one, so when I heard about SMU's new course, I jumped at the chance."" He is keen on a broad-based education as he believes it will train him to be versatile and adaptable and enable him to switch careers. ""You know what they say about students having to take on jobs that don't exist today. ""I really do believe that. That's why it is best to have a broad-based education, so that you have a broad understanding of issues and how the world works.""",12.844284130182803
2016,interview,"All admission related questions specifically related to AY2017/18 (NUS, NTU and SMU only) are welcome in this thread. Ask away! Create a HWZ account if you need to ask a question or to contribute to the discussion.For other universities e.g. SUTD, SIT and UniSIM/SUSS, please look up for their respective threads in the Degree subforum.THREAD GROUND RULES: STRICTLY NO OUT-OF-TOPIC DISCUSSIONS, ARGUMENTS OF ANY KIND, ABUSIVE/ INSENSITIVE/ SARCASTIC/ CONDESCENDING LANGUAGE AND XENOPHOBIC COMMENTS IN THIS THREAD, AS PER HWZ TERMS OF SERVICE. OFFENDERS MAY BE INFRACTED FOR FORUM NUISANCE. This thread strives to welcome everyone, regardless of nationality and background; the least one can do is to be nice and harmonious to everyone, and exercise sensitivity on certain issues.bosssaizo wrote:  Seeing a lot of new members in this thread. Please take note on a few things:No spamming just to hit the min post count for PM.Folks who originate from EDMW, please refrain from using the lingo and bringing in the culture from EDMW.Stay in topic. Thanks. University Admission thread in Reddit (r/Singapore):2017 University Application Season MegathreadPrevious year threads:http://forums.hardwarezone.com.sg/de...e-5205927.htmlhttp://forums.hardwarezone.com.sg/de...a-5433972.htmlhttp://forums.hardwarezone.com.sg/de...e-4854297.htmlhttp://forums.hardwarezone.com.sg/de...e-4315732.htmlHistorical IGP Freshmen AY2008/09 to AY2016/17 for both A Level (in numerical rank points) and Poly applicants (in CGPA)https://docs.google.com/spreadsheets...T7nLKc/pubhtmlHistorical GES Class of 2008 to 2016https://docs.google.com/spreadsheets...kYuPc8/pubhtmlAppeal Chance Rater (ACR) AY2017/18 Listing of all current offers made in this threadhttps://docs.google.com/spreadsheets...lVcb2o/pubhtmlAll confirmed admission results (from this year's admission exercise, whether offered or rejected) posted on this thread will be used to compile the Appeal Chance Rater. If you have been offered, please assist your peers who are waiting for their offer. To post your offers/ rejections in this thread, please include:- A Level total rank point OR Poly CGPA (6sem) with O Level raw L1R4  (For rank points, please do calculate one with MT, one without MT and take the higher one for reference. Use this calculator if in doubt. For Poly CGPA, I accept only 6sem from now onwards, and please give it in 2 decimal places, do not round up) If from PFP or ITE prior to poly, do state N Level results, PFP phase or ITE GPA. - List ALL your choices for each university application (up till the offered course, or else all choices if you're rejected) - Offered course/ Rejected status, and whether the offer is made under DA or borderline interview (if any) (must be confirmed offer). If you have DAed, briefly state your achievements and accomplishments - Singaporean/ PR/ Foreign Student (foreigners studying local schools are still counted as international students, and as such subject to the 18% quota) I cannot accept any input via PM. All inputs must come from this thread only. Thank you for your help.Appeal Dates:NUS: 24 to 31 MayNTU: 13 to 28 MaySMU: 2 May to 18 July May the odds be ever in your favour.",12.651474120669604
