year,search term,sentence,score
2017,interview,"middleofnowhere wrote:  If you get accepted they will send an sms, if is rejection I think they won't notify you and you have to check the portal yourself to see. i see... thanks.nekomon wrote:  Hi everyone! I'm new to this forum as well and I've been checking this thread since uni application started. I came here because I'm pretty lost, ALL of my friends have been offered the course of their choice. I feel so left out. )-: This is a really tough period for me right now, and I'm pretty sure I'm not the only one here... But we've come so far so let's stay strong guys! Evidently, I fared badly for my A levels. RP 70 and I took bio in JC so I am not considering any engineering courses. I got offered NTU environmental engineering, but I am planning not to accept it (going to try to appeal to PPGA/psych/socio). I placed NUS FASS as my 1st choice – I know I have a slim to zero chance of getting it, but my teachers urged me to try anyway. I didn't apply through DA because I didn't have any commendable achievements and my portfolio is pretty much empty. However I did fill up the essay portion under ""Outstanding Achievements"", I'm not sure if that counts as DA? After 2 months of torturous waiting, I found out this evening that my NUS application has been processed on OASF. Similar to some of y'all above, the remarks are still ""NIL"" and I can't log on to JAP using my NUS app no. I can still access JAP via my NTU app no. and there isn't anything for NUS. What should I do? Anyway, I wanted to ask littledaisies and sushiqueen: for the FASS writing test and interview, is it only for DA? How about normal admission? Sigh. I am preparing for the worst and signed up for retake this year but my heart is like being hung on a cliff. I am lost, depressed and don't know what to do.  Thank you for reading this really long post, I'm just really worried because I really want to know of my outcome for NUS but I can't have my hopes up high... i didnt get shortlisted for FASS test so i cant help there!",11.301368704298218
2017,interview,"Joffany wrote:  hey guys, idk if this is the right place to post but could somebody help me with my question. I recently got rejected by nus medicine and dentistry and got offered my 3rd choice. I was hoping appeal into medicine (although I know its damn tough) and was wondering if I should include: 1) reiterate my achievements and relate it to my passion/how it'll do me good in medical school (altho it has already been highlighted in my portfolio la) OR 2) bring in something new and relate it to my interest in med (tbh I didn't do anything special during my time after the interviews and now). The portfolio I submitted had: UAS: 90 Competitions: 1) group Performing arts cca in jc (1st in international competition) 2) Overseas leadership trip in europe for performing arts in sec sch Leadership: 1)Small sporadic ones like, orientation group leader in jc, committee member in class CIP for a year, Leadership position in Life sciences club in sec sch, facilitator in external camp involving children and science Community/Work: 1) worked with organisation dealing w intellectually disabled for extended period 2) one week attachment at local hospital 3) was a combat medic in the army  tbh i thought my portfolio was slightly above average and didn't really know where in the interviews did I make a fatal mistake to deny me entry into med school :-( help someone? I have friends studying at NUS Medical and Dental. From their feedback, I share: Both fields attract top JC/Poly grads. Your CCA/Achievements portfolios are what most potential candidates had too. For Medicine: The interviews decide one fate cos almost everyone is RP 90 points. For Dentistry: One's dexterity is tested during the interviews. The mouth is a relatively small space for a dentist to work. Do not lost heart, you can always apply to Duke NUS Medical School after obtaining your Bachelor Degree if you are still keen to study medicine.",11.234870884180241
2017,interview,"pepenim wrote:  Hi! Thanks so much for your reply sorry had to make you repeat  But erm I understand the merit part but my reasoning is that even though I have a merit (top 10% of graduating cohort), I don't have stellar GPA. I think this is mostly because I'm from a humanities dip which is more project based so hence more subjective in gradings. I know of friends in engineering with 3.9 GPA but no merit. So if I had a merit in let say a business course, I would have a 3.9 GPA and I believe that would give me a better shot at my course. You know what I mean? haha like there's no fair benchmark here so I tried to emphasise that a little in my appeal and requested for an interview.  I'm not from mass comm but I did talk about my experiences in marketing (i know it's slightly diff from advertising) like big scale projects and internship, as well as skills in designing, video editing etc in my personal statement (for DA) as well as appeal. I even mailed (not email lol) the dean and the programme department lol.  But I guess my chances are slim  maybe my O levels as well, didn't do very well ELR2B2 of 15. But if I had a 3.9 gpa?? Doubt that would make a diff lol. Life. Oh yes Humanities really much harder to score, but yeah glad you realise there's no fair benchmark. I think you can try to bank on your portfolio so far to give you an interview, but just don't hope so much?  Tbh speaking from my friends who were in mass comm, its already hard for them to make it into WKW, even if they meet the cut-off for poly. Not sure why but despite being a very hands-on, practical industry, they still favour JC kids more. I know an acquaintance who was offered scholarship simply because he had good A' Level results. I also have friends, who despite having a good portfolio of experience (internship with big companies, recommendation letter from their supervisors, took on side jobs related to the media), and did not manage to appeal successfully into WKW. But those who were from poly mass comm courses can get up to one year worth of exemption if I did not remember wrongly - on the provision if you get in lol.  Life is unfair, but more unfair to the poly kids. ",11.018882582892756
2017,interview,"I suggest you accept it first then appeal. I believe a lot of people out there would want to be in your position; you already have an offer. accept it first.nekomon wrote:  Hi everyone! I'm new to this forum as well and I've been checking this thread since uni application started. I came here because I'm pretty lost, ALL of my friends have been offered the course of their choice. I feel so left out. )-: This is a really tough period for me right now, and I'm pretty sure I'm not the only one here... But we've come so far so let's stay strong guys! Evidently, I fared badly for my A levels. RP 70 and I took bio in JC so I am not considering any engineering courses. I got offered NTU environmental engineering, but I am planning not to accept it (going to try to appeal to PPGA/psych/socio). I placed NUS FASS as my 1st choice – I know I have a slim to zero chance of getting it, but my teachers urged me to try anyway. I didn't apply through DA because I didn't have any commendable achievements and my portfolio is pretty much empty. However I did fill up the essay portion under ""Outstanding Achievements"", I'm not sure if that counts as DA? After 2 months of torturous waiting, I found out this evening that my NUS application has been processed on OASF. Similar to some of y'all above, the remarks are still ""NIL"" and I can't log on to JAP using my NUS app no. I can still access JAP via my NTU app no. and there isn't anything for NUS. What should I do? Anyway, I wanted to ask littledaisies and sushiqueen: for the FASS writing test and interview, is it only for DA? How about normal admission? Sigh. I am preparing for the worst and signed up for retake this year but my heart is like being hung on a cliff. I am lost, depressed and don't know what to do.  Thank you for reading this really long post, I'm just really worried because I really want to know of my outcome for NUS but I can't have my hopes up high... ",10.955770423660908
2018,interview,"geeniee wrote:  Allow me to break it down for you.  1) It appears to me from your various posts that you are still hung up over your L1R5 of 6. I am here to remind you that your O'Level results constitute only 20% for your admission, the other is 80% from your GPA. Your GPA is currently 2.5, whereas we all know Medicine only accepts those with straight A's for A'Levels, and the 10th percentile for poly kids is 3.91.  Therefore, your O'Level results of 6 is NOTHING in comparison to those who have 3.91 for their GPA, and most likely have equally good or if not at least single digit L1R5 scores.  2) Quoting this particular post by you, I am also here to remind you that NUS/NTU is not admitting you based on you being 2nd in your clique, but you are competing against EVERYONE else who applied for a place in the entire Singapore. No one cares how well you do relative to your friends - it is how well you do relative to the entire nation.  3) You insist you have organised many camps and events in polytechnic. You may try to apply under the Exceptional Individual Scheme (EIS) (their form of DA) for NUS if you deem it sufficient enough for you to enter Medicine. Nevertheless, do bear in mind that your service to your school/course is not as valuable as say, someone who chose to volunteer in an area that is related to Medicine. For example, working at the pharmacy, volunteering simple first aid services to the elderly in need/staying alone.  4) Universities does not taking into consideration your past in NS, because JC kids who got in would be training to be medical doctors to serve in NS anyway.  You asked for people to rate your chances, and just because many rated it as very low or even impossible, you call people a wet blanket. If anything, you ought to know that prospective Medicine students have to go through 8 rounds of interview (last heard from a year 3 med student herself) to get in, each testing for different values in you. You are not showing me that you are able to take constructive feedback and given the competitiveness of the places for Medicine, you would most likely have failed the interview, if you even get called up.  I hope you see that your chances are as good as impossible, simply because anyone with a GPA of below 3 would NOT stand a chance for ANY courses in ANY local university. Universities admit based on grades, that's why they have a IGP, and very little on your CCA. Heck, even the Ivy League universities who are considerably more open with their admissions policies still have a minimum baseline for SAT results.  Do update us in time to come when you have received a decision from the universities.  Well Said Geeniee! Totally spot on the equally good L1R5. Meatboi96  Just My 2 Cents: I would like to tell you good luck but sometimes its good to take a step back and absorb all the comments in the forums. I don't think that they're trying to be a 'wet blanket' to pull you down but trying to process  some thoughts. From your comments you seemed like a confident person but maybe a little hung onto your past, you may have scored well during O lvls for L1R4 but maybe things happen which caused you to not do well. However consoling yourself that you're the second of your clique doesn't seem to me as a good mindset as you're just limiting yourself. (Staying in your comfort zone.)  Maybe you can try studying for SATs and A lvls for next year or maybe for when you ORD like little by little during the weekends or something. It could be helpful  And you don't have to challenge me about my grades i scored 2.1 G.P.A during poly hahaha Honestly wish you the best for your application ",13.835415081761706
2018,interview,"bartblue wrote:  ICT student with a different perspective here. Yes the director said that. Yes the deadlines are like that.  But, noone said you can't submit projects early. Also this is university. Anyone who expects projects to be scoped to only what is learnt in lectures needs a wake up call. Also, the fear mongering here is a little overdone. Its all about the aptitude for absorbing information. I know a guy from an unrelated diploma with 0 coding knowledge on track for first class while a 3.6 it diploma person is struggling to pass. I come from a decent secondary school. 80% of my class went to A levels. Majority dont even consider SIT. Those good enough to go to NTU SMU NUS SUTD will go there instead. The students in ICT right now are basically guinea pigs. Its a risk they dont have to take.  For those that don't do well enough probably don't like studying altogether and would rather go to sim for a faster degree or will choose to retake a levels. That leaves us with the ones that do badly for A levels and are desperate to get into a 'local uni' without wasting time. Its not surprising that these people end up getting rejected after being interviewed. Edit: One thing that I need to mention is the program is in NO WAY designed that you NEED to know how to code before coming. Saying so is discrediting the professors that work hard to design the program.  The ramp up is fast I admit, but thats the nature of computer science ask anyone in nus/ntu comp sci or smu is, they will tell you the same thing. The first semester subject starts the knowledge train from SCRATCH. If you don't believe me, ask the famous yanying/guyz92 to send you the first few lectures for 1002, which module title is literally programming fundamentals.  I challenge anyone who has seen that to tell me that its not meant for someone with 0 background in coding. The professors themselves reiterate in the first lecture to tell us not to worry if you have no background because they will teach the basics to you. Agreed on the part for ICT1002 Programming Fundamental, Python is for beginners to learn as var in Python is loosely assign, don't have to care about memory allocation etc. Once student touch C will be another extreme. Memory allocation now is important, assigning var with wrong format and precision will cause C application to crash. For ICT1004, given 4 weeks to create a scheduling system in PHP, SQL, CSS3,HTML5 following the semantic requirements, JavaScript/jQuery. If you are unlucky that 2 of out of 4 teammates not contribute much, you will having the feeling of a sinking boat. Just a project in ICT1004 implement all this different language.  If you are totally new to programming, having ICT1001 supplement these knowledge such as SQL query statement. ICT1001 doesn't teach how to write stored procedure and other more advanced SQL statement such as left join, right join, union etc, while project if you know these trick, it can decrease the burden of writing inefficient codes. Also freeloader in ICT is another problem, playing taichi and act blur not contributing to project while others doing the project, they use the time to study for class test and exam. Also known as ""being carried"". During exam for the first trimester, some wrote C code in PHP question, PHP code in Python question, Python code in JavaScript. You will have the confusion especially when you do not have the IDE to highlight code error.",13.71011926804032
2018,interview,"Meatboi96 wrote:  You still haven’t explain to me why you are being a wet blanket. And besides I have got a pretty high GPA among all my friends. I am the second in my clique, the first got 2.7 GPA. The teacher mention to me once after class that I am a bright student with the potential to achieve my dreams as shown from what I have achieve during O level which i got 6points (L1R4). Allow me to break it down for you.  1) It appears to me from your various posts that you are still hung up over your L1R5 of 6. I am here to remind you that your O'Level results constitute only 20% for your admission, the other is 80% from your GPA. Your GPA is currently 2.5, whereas we all know Medicine only accepts those with straight A's for A'Levels, and the 10th percentile for poly kids is 3.91.  Therefore, your O'Level results of 6 is NOTHING in comparison to those who have 3.91 for their GPA, and most likely have equally good or if not at least single digit L1R5 scores.  2) Quoting this particular post by you, I am also here to remind you that NUS/NTU is not admitting you based on you being 2nd in your clique, but you are competing against EVERYONE else who applied for a place in the entire Singapore. No one cares how well you do relative to your friends - it is how well you do relative to the entire nation.  3) You insist you have organised many camps and events in polytechnic. You may try to apply under the Exceptional Individual Scheme (EIS) (their form of DA) for NUS if you deem it sufficient enough for you to enter Medicine. Nevertheless, do bear in mind that your service to your school/course is not as valuable as say, someone who chose to volunteer in an area that is related to Medicine. For example, working at the pharmacy, volunteering simple first aid services to the elderly in need/staying alone.  4) Universities does not taking into consideration your past in NS, because JC kids who got in would be training to be medical doctors to serve in NS anyway.  You asked for people to rate your chances, and just because many rated it as very low or even impossible, you call people a wet blanket. If anything, you ought to know that prospective Medicine students have to go through 8 rounds of interview (last heard from a year 3 med student herself) to get in, each testing for different values in you. You are not showing me that you are able to take constructive feedback and given the competitiveness of the places for Medicine, you would most likely have failed the interview, if you even get called up.  I hope you see that your chances are as good as impossible, simply because anyone with a GPA of below 3 would NOT stand a chance for ANY courses in ANY local university. Universities admit based on grades, that's why they have a IGP, and very little on your CCA. Heck, even the Ivy League universities who are considerably more open with their admissions policies still have a minimum baseline for SAT results.  Do update us in time to come when you have received a decision from the universities. ",12.902084309548927
2018,interview,"Hi,friend. May I know roughly how many places are offered for allied health courses? I was rejected by SIT this week, I am not even on the waitlist. I wonder is it worth for me to appeal if the intake for DR is very low. I cant find any information online.dontgiveup wrote:  Hi ! ~  I just wanna say good job to those who completed the interview for SIT allied health whether or not you have succeeded in being accepted.  For those whom will be attending the upcoming Tea Session, you will actually find out that how lucky u r to get it cos the numbers arent exactly very large (particularly RT cos the intake is only about 18 students).  Those who got shortlisted for interview is already considered very good. Because majority of the students would have gotten rejected from the start. And from the interview itself only about 1-2/8 students will get accepted.  So dont feel too upset about it as well.  To those who plans to try again, GO FOR IT! But do prepare your portfolio in the 1 year apart. Because once u have been shortlisted for interview, results and all no longer matters. It is merely about who u r ... interviewers have 0 knowledge or background on u , it is just how u r reacting. It is normal to fail one or two stations, but more importantly is not letting it affect you.  After all , if u want to be an Allied Health professional u have to strong mentally.  The interview gives u a glimpse of school life. In SIT we go by Trimesters, so this mean to say it is definitely more stressful. U will need to write at least an essay per trimester , so be prepared.  Even for those who got accepted, the tip is just PLAY WHILE U CAN NOW.  Just to share a personal story for those who didnt got in :  2017 was the first year this course started , to be honest i found out the minimum GPA for that year from friends who got in ... it was at least 3.7 just for interview.  I attempted as well (i wanted medicine), but i didnt even got shortlisted.  Yes, it is sad to be rejected ( in fact i applied to NTU, NUS and SIT i got rejected for all of them). But what is more important is , what u plan to do.  Getting sad is inevitable , but it doesnt get u anywhere. Why not let it be ur motivation ? Go for shadowing programmes- see if u r really in for it (we have ppl who realised it isnt their thing after getting in). Volunteer - Gain some experience and show them healthcare is for you.  Lastly, for me ... it was hard but as a poly grad i had issues finding jobs even. Eventually, i lowered myself and worked as a hospital patient assistant for a year. No doubt, it was difficult but at the end of it i do learn something.  I made use of my time in the healthcare setting understanding more on it, being look down is common but it makes u a better healthcare professional when u have experience what it is like to be the one being looked down before u become the one ordering people ard.  Eventually i got in and it was a miracle.  So it is not impossible to get in again but of course success is yours only if u have worked hard for it.  So, dont give up if it is really what u want.  And congratulations to those who got in .... ",12.553805139645613
2018,interview,"guyz92 wrote:  During my day zero event at SIT Dover last year, the Deputy Program Director for Software Engineering did said something about ""Everyone who are enrolled into ICT are from Polytechnic"".  The reason for this is they design the program in such a way that you need to know how to code before enroll to the program. ICT SE and IS is very intensive, beginners will have a hard time to catch up. For example, one of our project is to write a web crawler and do data analysis and come out application(s) in C++, it must complete within 4 weeks. Those who have zero programming background will suffer very badly. The lecture slides only teach you how to sit, but project expect you to fly. We have other project running concurrently, including class test. Once project submission is up, next week (two days later) our first exam paper. ICT student with a different perspective here. Yes the director said that. Yes the deadlines are like that.  But, noone said you can't submit projects early. Also this is university. Anyone who expects projects to be scoped to only what is learnt in lectures needs a wake up call. Also, the fear mongering here is a little overdone. Its all about the aptitude for absorbing information. I know a guy from an unrelated diploma with 0 coding knowledge on track for first class while a 3.6 it diploma person is struggling to pass. I come from a decent secondary school. 80% of my class went to A levels. Majority dont even consider SIT. Those good enough to go to NTU SMU NUS SUTD will go there instead. The students in ICT right now are basically guinea pigs. Its a risk they dont have to take.  For those that don't do well enough probably don't like studying altogether and would rather go to sim for a faster degree or will choose to retake a levels. That leaves us with the ones that do badly for A levels and are desperate to get into a 'local uni' without wasting time. Its not surprising that these people end up getting rejected after being interviewed. Edit: One thing that I need to mention is the program is in NO WAY designed that you NEED to know how to code before coming. Saying so is discrediting the professors that work hard to design the program.  The ramp up is fast I admit, but thats the nature of computer science ask anyone in nus/ntu comp sci or smu is, they will tell you the same thing. The first semester subject starts the knowledge train from SCRATCH. If you don't believe me, ask the famous yanying/guyz92 to send you the first few lectures for 1002, which module title is literally programming fundamentals.  I challenge anyone who has seen that to tell me that its not meant for someone with 0 background in coding. The professors themselves reiterate in the first lecture to tell us not to worry if you have no background because they will teach the basics to you.",12.49811960211358
